{
  "delegation_id": "delegation-1",
  "grantor": "root-entity",
  "grantee": "entity-1",
  "authority": {
    "id": "auth-1",
    "action": "payment.refund",
    "capabilities": ["refund"],
    "constraints": {"max_amount": 500},
    "scope": "payment",
    "grantor": "root-entity",
    "grantee": "entity-1"
  },
  "capabilities": ["refund"],
  "constraints": {"max_amount": 500},
  "scope": "payment",
  "status": "ACTIVE",
  "depth": 1,
  "max_delegation_depth": 3
}
